post_id,text,post_text,shared_text,time,image,likes,comments,shares,post_url,link
10157642538411888,"La exchica Yingo se refirió a la situación vivida por su expareja.
#NoNoticia
ADNRADIO.CL
Faloon Larraguibel se refirió a las funas en contra de Karol Lucero: “Se buscó un poco lo que le está pasando”","La exchica Yingo se refirió a la situación vivida por su expareja.
#NoNoticia","ADNRADIO.CL
Faloon Larraguibel se refirió a las funas en contra de Karol Lucero: “Se buscó un poco lo que le está pasando”",2020-03-23 13:14:43,https://external.fscl6-1.fna.fbcdn.net/safe_image.php?d=AQDFuPdM10_jXQ1L&w=476&h=249&url=https%3A%2F%2Fassets.adnradio.cl%2F2020%2F03%2Ffaloon2.png&cfs=1&jq=75&ext=jpg&_nc_hash=AQBBB5Nm7cygtqYX,7,10,0,https://m.facebook.com/story.php?story_fbid=10157642538411888&id=24723976887,https://www.adnradio.cl/espectaculos/2020/03/23/faloon-larraguibel-se-refirio-a-las-funas-en-contra-de-karol-lucero-se-busco-un-poco-lo-que-le-esta-pasando.html
10157642882581888,"La vocera hizo un llamado a los alcaldes a ser cuidadosos con los protocolos y a mantener una línea al momento de informar algo de esa índole.
ADNRADIO.CL
Rubilar por anuncio de Barriga sobre segundo fallecimiento: “Necesitamos una sola voz”",La vocera hizo un llamado a los alcaldes a ser cuidadosos con los protocolos y a mantener una línea al momento de informar algo de esa índole.,"ADNRADIO.CL
Rubilar por anuncio de Barriga sobre segundo fallecimiento: “Necesitamos una sola voz”",2020-03-23 13:08:12,https://external.fscl6-1.fna.fbcdn.net/safe_image.php?d=AQC_cBfuD9o8oQES&w=476&h=249&url=https%3A%2F%2Fassets.adnradio.cl%2F2020%2F03%2FA_UNO_1168899-e1584978758479.jpg&cfs=1&jq=75&ext=jpg&_nc_hash=AQAySWz6A0XgdhHU,98,349,44,https://m.facebook.com/story.php?story_fbid=10157642882581888&id=24723976887,https://www.adnradio.cl/nacional/2020/03/23/rubilar-por-anuncio-de-barriga-sobre-segundo-fallecimiento-necesitamos-una-sola-voz.html
10157642350331888,"El histórico boxeador publicó un divertido registro a través de las redes sociales 😂😂🥊🥊.
ADNRADIO.CL
VIDEO | Mike Tyson se mantiene entrenando junto a su perro en cuarentena",El histórico boxeador publicó un divertido registro a través de las redes sociales 😂😂🥊🥊.,"ADNRADIO.CL
VIDEO | Mike Tyson se mantiene entrenando junto a su perro en cuarentena",2020-03-23 13:07:26,https://external.fscl6-1.fna.fbcdn.net/safe_image.php?d=AQCtlf5WTmT_Xy84&w=476&h=249&url=https%3A%2F%2Fassets.adnradio.cl%2F2020%2F03%2Fbf965c95d3fb2bc81b09964f39ccb3da-e1584970289945.jpg&cfs=1&jq=75&ext=jpg&_nc_hash=AQD3xoN95UD7dahv,35,0,3,https://m.facebook.com/story.php?story_fbid=10157642350331888&id=24723976887,https://www.adnradio.cl/deportes/2020/03/23/video-mike-tyson-se-mantiene-entrenando-junto-a-su-perro-en-cuarentena.html
10157642528906888,"Mauricio Gejman es actual Seremi de Deportes en la región de la Araucanía.
ADNRADIO.CL
Expresidente de Deportes Temuco dio positivo en examen de coronavirus",Mauricio Gejman es actual Seremi de Deportes en la región de la Araucanía.,"ADNRADIO.CL
Expresidente de Deportes Temuco dio positivo en examen de coronavirus",2020-03-23 13:00:15,https://external.fscl6-1.fna.fbcdn.net/safe_image.php?d=AQDoGpmO6BrnQtl6&w=476&h=249&url=https%3A%2F%2Fassets.adnradio.cl%2F2020%2F03%2F5dde44037ce2c4eb98920f9977e6e456-e1584973554700.png&cfs=1&jq=75&ext=jpg&_nc_hash=AQDSFLZm0Z_a3eAf,16,0,7,https://m.facebook.com/story.php?story_fbid=10157642528906888&id=24723976887,https://www.adnradio.cl/futbol/2020/03/23/expresidente-de-deportes-temuco-dio-positivo-en-examen-de-coronavirus.html
10157642540611888,"La cantante de Barbados no es la única que ha colaborado a la causa.
ADNRADIO.CL
Rihanna donó 5 millones de dólares para combatir las consecuencias del Covid-19",La cantante de Barbados no es la única que ha colaborado a la causa.,"ADNRADIO.CL
Rihanna donó 5 millones de dólares para combatir las consecuencias del Covid-19",2020-03-23 12:53:04,https://external.fscl6-1.fna.fbcdn.net/safe_image.php?d=AQDlM37ITtPjT8DJ&w=476&h=249&url=https%3A%2F%2Fassets.adnradio.cl%2F2020%2F03%2F1537572565-0001942gf.jpg&cfs=1&jq=75&ext=jpg&_nc_hash=AQDKw301ckHoJlXk,292,125,33,https://m.facebook.com/story.php?story_fbid=10157642540611888&id=24723976887,https://www.adnradio.cl/espectaculos/2020/03/23/rihanna-dono-5-millones-de-dolares-para-combatir-las-consecuencias-del-covid-19.html
10157642649906888,"FOTOS | Esto ante las medidas impuestas por el presidente transandino Alberto Fernández para evitar el avance de contagio del Covid 19.
ADNRADIO.CL
Iglesia argentina celebró misa a través de streaming para evitar contagios de coronavirus",FOTOS | Esto ante las medidas impuestas por el presidente transandino Alberto Fernández para evitar el avance de contagio del Covid 19.,"ADNRADIO.CL
Iglesia argentina celebró misa a través de streaming para evitar contagios de coronavirus",2020-03-23 12:47:49,https://external.fscl6-1.fna.fbcdn.net/safe_image.php?d=AQA2g-JhQtRT1T5M&w=476&h=249&url=fbstaging%3A%2F%2Fgraph.facebook.com%2Fstaging_resources%2FMDExOTEwNDQ4NTIzNDkzMjE6MTk3MDg3NTczOQ%3D%3D&cfs=1&jq=75&ext=jpg&_nc_hash=AQBbbuVMdl1mFX8g,11,5,0,https://m.facebook.com/story.php?story_fbid=10157642649906888&id=24723976887,https://bit.ly/2IXQCdi
10157642420376888,"La noticia fue confirmada por el cantante en sus redes sociales.
ADNRADIO.CL
Falleció madre de Miguel Bosé en España producto de una neumonía",La noticia fue confirmada por el cantante en sus redes sociales.,"ADNRADIO.CL
Falleció madre de Miguel Bosé en España producto de una neumonía",2020-03-23 12:40:20,https://external.fscl6-1.fna.fbcdn.net/safe_image.php?d=AQCCPTDkYYzeSucw&w=476&h=249&url=fbstaging%3A%2F%2Fgraph.facebook.com%2Fstaging_resources%2FMDE1NzMyMjI4MjM1NDU1NjE6NjA4OTc3MjI4&cfs=1&jq=75&ext=jpg&_nc_hash=AQD40Nu08hghzaqY,3,0,0,https://m.facebook.com/story.php?story_fbid=10157642420376888&id=24723976887,https://bit.ly/2IXQCdi
10157642475971888,"El brasileño entregó un crudo testimonio de cómo es enfrentar la enfermedad.
ADNRADIO.CL
Jugador del Elche afectado por coronavirus: “Sufrí mucho, ni siquiera tenía fuerzas para nada”",El brasileño entregó un crudo testimonio de cómo es enfrentar la enfermedad.,"ADNRADIO.CL
Jugador del Elche afectado por coronavirus: “Sufrí mucho, ni siquiera tenía fuerzas para nada”",2020-03-23 12:35:01,https://external.fscl6-1.fna.fbcdn.net/safe_image.php?d=AQCa9o9FKbfrerJ9&w=476&h=249&url=https%3A%2F%2Fassets.adnradio.cl%2F2020%2F03%2FGettyImages-1206106705-e1584972499383.jpg&cfs=1&jq=75&ext=jpg&_nc_hash=AQBbGZhdzkupodsY,3,0,0,https://m.facebook.com/story.php?story_fbid=10157642475971888&id=24723976887,https://bit.ly/3bhx8fJ
10157642380051888,"La idea es que los concursantes no se atrasen y puedan aprender desde la seguridad de sus hogares.
ADNRADIO.CL
Participantes de Yo Soy tendrán clases virtuales debido al coronavirus",La idea es que los concursantes no se atrasen y puedan aprender desde la seguridad de sus hogares.,"ADNRADIO.CL
Participantes de Yo Soy tendrán clases virtuales debido al coronavirus",2020-03-23 12:28:50,https://external.fscl6-1.fna.fbcdn.net/safe_image.php?d=AQAkfKDhZ3cduQ5E&w=476&h=249&url=https%3A%2F%2Fassets.adnradio.cl%2F2020%2F03%2Fyo-soy-bose3-768x391.jpg&cfs=1&jq=75&ext=jpg&_nc_hash=AQC6DoU6FJK_NKI-,10,0,0,https://m.facebook.com/story.php?story_fbid=10157642380051888&id=24723976887,https://www.adnradio.cl/television/2020/03/23/participantes-de-yo-soy-tendran-clases-virtuales-debido-al-coronavirus.html
10157642700396888,"VIDEO | La alcaldesa de Maipú fue muy criticada por el hecho.
ADNRADIO.CL
Cathy Barriga informó muerte por coronavirus antes que el Minsal: tuvo duro debate con Matthei y Bolocco",VIDEO | La alcaldesa de Maipú fue muy criticada por el hecho.,"ADNRADIO.CL
Cathy Barriga informó muerte por coronavirus antes que el Minsal: tuvo duro debate con Matthei y Bolocco",2020-03-23 12:16:48,https://external.fscl6-1.fna.fbcdn.net/safe_image.php?d=AQCz1JDdMQLTDQwf&w=476&h=249&url=https%3A%2F%2Fassets.adnradio.cl%2F2020%2F03%2Faaa-2-e1584976173384.jpg&cfs=1&jq=75&ext=jpg&_nc_hash=AQCQRuo3NHrREFJd,750,760,111,https://m.facebook.com/story.php?story_fbid=10157642700396888&id=24723976887,https://www.adnradio.cl/television/2020/03/23/cathy-barriga-informo-segunda-muerte-por-coronavirus-antes-que-el-minsal-tuvo-duro-debate-con-matthei-y-bolocco.html
10157642375396888,"La bailarina entregó tips para pasar el aislamiento.
#NoNoticia
ADNRADIO.CL
Maura Rivera contó cómo vive la cuarentena junto a Mark González","La bailarina entregó tips para pasar el aislamiento.
#NoNoticia","ADNRADIO.CL
Maura Rivera contó cómo vive la cuarentena junto a Mark González",2020-03-23 12:10:24,https://external.fscl6-1.fna.fbcdn.net/safe_image.php?d=AQCrbUaXNt3j44vp&w=476&h=249&url=https%3A%2F%2Fassets.adnradio.cl%2F2020%2F03%2F78812203_752331085254153_6648671205942403373_n-e1584970171352.jpg&cfs=1&jq=75&ext=jpg&_nc_hash=AQD0j-Y_-GdPWuNk,42,265,4,https://m.facebook.com/story.php?story_fbid=10157642375396888&id=24723976887,https://www.adnradio.cl/espectaculos/2020/03/23/maura-rivera-conto-como-vive-la-cuarentena-junto-a-mark-gonzalez.html
10157642396056888,"El arquero de Everton ha tenido una gran temporada junto a los viñamarinos ⚽️⚽️.
ADNRADIO.CL
Johnny Herrera y la opción de retirarse: “Veremos cómo pasa el año”",El arquero de Everton ha tenido una gran temporada junto a los viñamarinos ⚽️⚽️.,"ADNRADIO.CL
Johnny Herrera y la opción de retirarse: “Veremos cómo pasa el año”",2020-03-23 12:03:00,https://external.fscl6-1.fna.fbcdn.net/safe_image.php?d=AQAtc8vVt3JwHBGE&w=476&h=249&url=https%3A%2F%2Fassets.adnradio.cl%2F2020%2F03%2FA_UNO_1163128-1-e1584971076403.jpg&cfs=1&jq=75&ext=jpg&_nc_hash=AQCBdvCQa_CGvyVq,9,0,0,https://m.facebook.com/story.php?story_fbid=10157642396056888&id=24723976887,https://www.adnradio.cl/futbol/2020/03/23/johnny-herrera-y-la-opcion-de-retirarse-veremos-como-pasa-el-ano.html
10157642208496888,"¿Qué pasó? ¿Por qué esa decisión? 😟😟
ADNRADIO.CL
Inesperada salida de Leo Caprile de MasterChef Chile causó sorpresa entre los televidentes",¿Qué pasó? ¿Por qué esa decisión? 😟😟,"ADNRADIO.CL
Inesperada salida de Leo Caprile de MasterChef Chile causó sorpresa entre los televidentes",2020-03-23 11:56:44,https://external.fscl6-1.fna.fbcdn.net/safe_image.php?d=AQAkhvwnpsW_xu1J&w=476&h=249&url=https%3A%2F%2Fassets.adnradio.cl%2F2020%2F03%2FM2-1536x1024.jpg&cfs=1&jq=75&ext=jpg&_nc_hash=AQAHkAU83xdqxLq-,10,20,0,https://m.facebook.com/story.php?story_fbid=10157642208496888&id=24723976887,https://www.adnradio.cl/television/2020/03/23/inesperada-salida-de-leo-caprile-de-masterchef-chile-causo-sorpresa-entre-los-televidentes.html
10157642338241888,"El panorama se ensombreció más al estar atascado en el Senado de Estados Unidos un paquete de estímulos económicos propuestos por Donald Trump.
ADNRADIO.CL
Bolsas de valores del mundo se desploman por coronavirus Covid-19",El panorama se ensombreció más al estar atascado en el Senado de Estados Unidos un paquete de estímulos económicos propuestos por Donald Trump.,"ADNRADIO.CL
Bolsas de valores del mundo se desploman por coronavirus Covid-19",2020-03-23 11:49:43,https://external.fscl6-1.fna.fbcdn.net/safe_image.php?d=AQBDXZg1VGMhuA71&w=476&h=249&url=https%3A%2F%2Fassets.adnradio.cl%2F2020%2F03%2FGettyImages-457266460-e1584970033991.jpg&cfs=1&jq=75&ext=jpg&_nc_hash=AQByD6pfGVXISIyE,9,1,2,https://m.facebook.com/story.php?story_fbid=10157642338241888&id=24723976887,https://www.adnradio.cl/economia/2020/03/23/bolsas-del-mundo-se-desploman-por-coronavirus-covid-19.html
10157642376976888,"VIDEO | La ""CuarenKena"" sacó carcajadas en Instagram.
#NoNoticia
ADNRADIO.CL
Javiera Contador revivió a Kena Larraín para hablar sobre la cuarentena y el coronavirus","VIDEO | La ""CuarenKena"" sacó carcajadas en Instagram.
#NoNoticia","ADNRADIO.CL
Javiera Contador revivió a Kena Larraín para hablar sobre la cuarentena y el coronavirus",2020-03-23 11:46:30,https://external.fscl6-1.fna.fbcdn.net/safe_image.php?d=AQA71D77iEb8ci-S&w=476&h=249&url=https%3A%2F%2Fassets.adnradio.cl%2F2020%2F03%2F46304_2_5903f5ab2a760.jpg&cfs=1&jq=75&ext=jpg&_nc_hash=AQDfqvzJjVbH03Ry,26,11,4,https://m.facebook.com/story.php?story_fbid=10157642376976888&id=24723976887,https://www.adnradio.cl/espectaculos/2020/03/23/javiera-contador-revivio-a-kena-larrain-para-hablar-sobre-la-cuarentena-y-el-coronavirus.html
10157642292016888,"FOTOS Y VIDEO | El delantero de la ""Roja"" publicó tiernas imágenes de sus cachorros 😍⚽️.
ADNRADIO.CL
Alexis Sánchez agrandó su familia “perruna”: Presentó a dos nuevas mascotas","FOTOS Y VIDEO | El delantero de la ""Roja"" publicó tiernas imágenes de sus cachorros 😍⚽️.","ADNRADIO.CL
Alexis Sánchez agrandó su familia “perruna”: Presentó a dos nuevas mascotas",2020-03-23 11:39:30,https://external.fscl6-1.fna.fbcdn.net/safe_image.php?d=AQAYs136Qre0riHc&w=476&h=249&url=https%3A%2F%2Fassets.adnradio.cl%2F2020%2F03%2Ffoto_0000000720160301093548-1200x600.jpg&cfs=1&jq=75&ext=jpg&_nc_hash=AQCD-O2roXwBucgP,120,135,0,https://m.facebook.com/story.php?story_fbid=10157642292016888&id=24723976887,https://www.adnradio.cl/futbol/2020/03/23/alexis-sanchez-agrando-su-familia-perruna-presento-a-dos-nuevas-mascotas.html
10157642563776888,"ACTUALIZACIÓN | Previo al anuncio del Minsal, Cathy Barriga, alcaldesa de Maipú, había señalado la situación en el ""Mucho Gusto"" de Mega.
ADNRADIO.CL
Minsal anunció segundo fallecimiento por coronavirus en Chile","ACTUALIZACIÓN | Previo al anuncio del Minsal, Cathy Barriga, alcaldesa de Maipú, había señalado la situación en el ""Mucho Gusto"" de Mega.","ADNRADIO.CL
Minsal anunció segundo fallecimiento por coronavirus en Chile",2020-03-23 11:38:25,https://external.fscl6-1.fna.fbcdn.net/safe_image.php?d=AQBJElOrsjurBXkA&w=476&h=249&url=fbstaging%3A%2F%2Fgraph.facebook.com%2Fstaging_resources%2FMDEyMjY5MDYxOTg2Njg5Mzc6MTgzODgzODg1Mg%3D%3D&cfs=1&jq=75&ext=jpg&_nc_hash=AQAfo0QFSeI9gHqs,23,12,7,https://m.facebook.com/story.php?story_fbid=10157642563776888&id=24723976887,https://www.adnradio.cl/nacional/2020/03/23/minsal-anuncio-segundo-fallecimiento-por-coronavirus-en-chile.html
10157642324536888,"""Cuidarnos es responsabilidad de todos"", dijeron en redes sociales.
ADNRADIO.CL
Registro Civil anunció nuevo horario de atención para sumarse a campaña contra el coronavirus","""Cuidarnos es responsabilidad de todos"", dijeron en redes sociales.","ADNRADIO.CL
Registro Civil anunció nuevo horario de atención para sumarse a campaña contra el coronavirus",2020-03-23 11:32:18,https://external.fscl6-1.fna.fbcdn.net/safe_image.php?d=AQBWFj9Q_CHOkSc5&w=476&h=249&url=fbstaging%3A%2F%2Fgraph.facebook.com%2Fstaging_resources%2FMDEyNDk5MjgyODI3MTIwMDA6MTU4NDgwMzE0MQ%3D%3D&cfs=1&jq=75&ext=jpg&_nc_hash=AQCB-ompd2HMu4jp,3,0,4,https://m.facebook.com/story.php?story_fbid=10157642324536888&id=24723976887,https://bit.ly/2IWyFf4
10157642207611888,"Pese a su situación, David Bryan le envió un mensaje de esperanza a sus seguidores.
ADNRADIO.CL
Tecladista de Bon Jovi confirmó que tiene coronavirus: “¡Por favor, no tengan miedo!”","Pese a su situación, David Bryan le envió un mensaje de esperanza a sus seguidores.","ADNRADIO.CL
Tecladista de Bon Jovi confirmó que tiene coronavirus: “¡Por favor, no tengan miedo!”",2020-03-23 11:25:47,https://external.fscl6-1.fna.fbcdn.net/safe_image.php?d=AQD4mGgDpVkQzdWA&w=476&h=249&url=https%3A%2F%2Fassets.adnradio.cl%2F2020%2F03%2F5871982.jpg&cfs=1&jq=75&ext=jpg&_nc_hash=AQBxD1PExU20rWob,70,8,26,https://m.facebook.com/story.php?story_fbid=10157642207611888&id=24723976887,https://www.adnradio.cl/internacional/2020/03/23/tecladista-de-bon-jovi-confirmo-que-tiene-coronavirus-por-favor-no-tengan-miedo.html
10157642323686888,"“Esto es un abuso y nos pone en una situación de absoluta desventaja frente a otros municipios que cuentan con más recursos”, dijo Juan Rozas,
ADNRADIO.CL
Alcalde de PAC denunció alza de hasta 900% en valor de mascarillas y guantes","“Esto es un abuso y nos pone en una situación de absoluta desventaja frente a otros municipios que cuentan con más recursos”, dijo Juan Rozas,","ADNRADIO.CL
Alcalde de PAC denunció alza de hasta 900% en valor de mascarillas y guantes",2020-03-23 11:18:10,https://external.fscl6-1.fna.fbcdn.net/safe_image.php?d=AQB0Z0QduOHBmbfn&w=476&h=249&url=https%3A%2F%2Fassets.adnradio.cl%2F2020%2F03%2FGettyImages-1205580183-1-e1584969349684.jpg&cfs=1&jq=75&ext=jpg&_nc_hash=AQB1o8k17NgdNbGl,69,64,162,https://m.facebook.com/story.php?story_fbid=10157642323686888&id=24723976887,https://www.adnradio.cl/nacional/2020/03/23/alcalde-de-pac-denuncio-alza-de-hasta-900-en-valor-de-mascarillas-y-guantes.html
10157642475361888,"Se trata de una paciente que padecía previamente de cáncer.
ADNRADIO.CL
Minsal anunció segundo fallecimiento por coronavirus en Chile",Se trata de una paciente que padecía previamente de cáncer.,"ADNRADIO.CL
Minsal anunció segundo fallecimiento por coronavirus en Chile",2020-03-23 11:13:00,https://external.fscl6-1.fna.fbcdn.net/safe_image.php?d=AQDIAnUYwUnFV-Nq&w=476&h=249&url=https%3A%2F%2Fassets.adnradio.cl%2F2020%2F03%2FAHORA-ROJO-TWITTER-1-925x470-1.jpg&cfs=1&jq=75&ext=jpg&_nc_hash=AQCmMG7d80_062D-,90,80,141,https://m.facebook.com/story.php?story_fbid=10157642475361888&id=24723976887,https://www.adnradio.cl/nacional/2020/03/23/minsal-anuncio-segundo-fallecimiento-por-coronavirus-en-chile.html
10157642111306888,"Al alcalde de Valparaíso se sumó a las críticas contra las autoridades de gobierno por la gran cantidad de personas movilizándose la mañana de este lunes.
ADNRADIO.CL
Jorge Sharp: ""Trenes llenos, micros llenas, queda claro que la economía manda, no la salud pública""",Al alcalde de Valparaíso se sumó a las críticas contra las autoridades de gobierno por la gran cantidad de personas movilizándose la mañana de este lunes.,"ADNRADIO.CL
Jorge Sharp: ""Trenes llenos, micros llenas, queda claro que la economía manda, no la salud pública""",2020-03-23 11:04:25,https://external.fscl6-1.fna.fbcdn.net/safe_image.php?d=AQD-i9K2SK9UMKly&w=476&h=249&url=fbstaging%3A%2F%2Fgraph.facebook.com%2Fstaging_resources%2FMDEyMTYyMzE0ODYxNTY3NzM6MTI2NzI2MDYxNg%3D%3D&cfs=1&jq=75&ext=jpg&_nc_hash=AQBNBJ_pkRBQWv5y,152,13,101,https://m.facebook.com/story.php?story_fbid=10157642111306888&id=24723976887,https://bit.ly/2IWyFf4
10157642410516888,"La reconocida artista italiana tenía 89 años.
ADNRADIO.CL
Murió la actriz y madre de Miguel Bosé, Lucía Bosé, producto de una neumonía",La reconocida artista italiana tenía 89 años.,"ADNRADIO.CL
Murió la actriz y madre de Miguel Bosé, Lucía Bosé, producto de una neumonía",2020-03-23 10:55:51,https://external.fscl6-1.fna.fbcdn.net/safe_image.php?d=AQCawf0Vcv-USoo2&w=476&h=249&url=https%3A%2F%2Fassets.adnradio.cl%2F2020%2F03%2F91020535_237191890789007_3371781213959056895_n-e1584971637136.jpg&cfs=1&jq=75&ext=jpg&_nc_hash=AQBgn9sVCCWwDBG5,61,21,62,https://m.facebook.com/story.php?story_fbid=10157642410516888&id=24723976887,https://www.adnradio.cl/espectaculos/2020/03/23/murio-la-actriz-y-madre-de-miguel-bose-lucia-bose-producto-del-coronavirus-covid-19.html
10157642213646888,"¿Dónde está el amor, del que tanto hablan?🎶💔
#NoNoticia
ADNRADIO.CL
¿Se acabó el amor?: Fanáticos de Mayte Rodríguez y Diego Boneta aseguran que ya no están juntos","¿Dónde está el amor, del que tanto hablan?🎶💔
#NoNoticia","ADNRADIO.CL
¿Se acabó el amor?: Fanáticos de Mayte Rodríguez y Diego Boneta aseguran que ya no están juntos",2020-03-23 10:50:57,https://external.fscl6-1.fna.fbcdn.net/safe_image.php?d=AQB0TnbKKolnrMmo&w=476&h=249&url=https%3A%2F%2Fassets.adnradio.cl%2F2020%2F03%2Fmayte-1024x556.jpg&cfs=1&jq=75&ext=jpg&_nc_hash=AQBrJ9YObnFxUkPo,88,812,10,https://m.facebook.com/story.php?story_fbid=10157642213646888&id=24723976887,https://www.adnradio.cl/espectaculos/2020/03/23/se-acabo-el-amor-fanaticos-de-mayte-rodriguez-y-diego-boneta-aseguran-que-ya-no-estan-juntos.html
10157642115481888,"La parlamentaria insistió en el llamado a la ""cuarentena obligatoria"" al gobierno de Sebastián Piñera.
ADNRADIO.CL
Pamela Jiles por aglomeraciones: ""Viajan amontonados mientras los patrones están en la playa""","La parlamentaria insistió en el llamado a la ""cuarentena obligatoria"" al gobierno de Sebastián Piñera.","ADNRADIO.CL
Pamela Jiles por aglomeraciones: ""Viajan amontonados mientras los patrones están en la playa""",2020-03-23 10:43:38,https://external.fscl6-1.fna.fbcdn.net/safe_image.php?d=AQB_tB01S3yZ9ohs&w=464&h=243&url=fbstaging%3A%2F%2Fgraph.facebook.com%2Fstaging_resources%2FMDEyMDc0ODYwODcxNDUzOTg6MTUzMzk2NTM4Nw%3D%3D&cfs=1&jq=75&ext=jpg&_nc_hash=AQAxMxp40Hc7ilLa,65,8,22,https://m.facebook.com/story.php?story_fbid=10157642115481888&id=24723976887,https://bit.ly/2IWyFf4
10157642177861888,"No hay claridad de cuándo se pueda volver a disputar un partido ⚽️😰🏆.
ADNRADIO.CL
FOTO | La Liga y RFEF anunciaron suspensión indefinida del fútbol",No hay claridad de cuándo se pueda volver a disputar un partido ⚽️😰🏆.,"ADNRADIO.CL
FOTO | La Liga y RFEF anunciaron suspensión indefinida del fútbol",2020-03-23 10:36:16,https://external.fscl6-1.fna.fbcdn.net/safe_image.php?d=AQAFNc3wI2vSqWeY&w=476&h=249&url=https%3A%2F%2Fassets.adnradio.cl%2F2020%2F03%2FA_UNO_1126421-e1584966943401.jpg&cfs=1&jq=75&ext=jpg&_nc_hash=AQAPefY1X0NUf3fx,6,0,0,https://m.facebook.com/story.php?story_fbid=10157642177861888&id=24723976887,https://www.adnradio.cl/futbol/2020/03/23/foto-la-liga-y-rfef-anunciaron-suspension-indefinida-de-futbol.html
10157642204706888,"FOTO | El intérprete de 79 años comunicó su situación en redes sociales.
ADNRADIO.CL
Plácido Domingo confirmó que tiene Covid-19: “Estoy en aislamiento por el tiempo que sea necesario”",FOTO | El intérprete de 79 años comunicó su situación en redes sociales.,"ADNRADIO.CL
Plácido Domingo confirmó que tiene Covid-19: “Estoy en aislamiento por el tiempo que sea necesario”",2020-03-23 10:29:00,https://external.fscl6-1.fna.fbcdn.net/safe_image.php?d=AQApfY8hcrec1A_6&w=476&h=249&url=https%3A%2F%2Fassets.adnradio.cl%2F2020%2F03%2FGettyImages-1185111656-e1582624879357-925x470.jpg&cfs=1&jq=75&ext=jpg&_nc_hash=AQD_OOiPigwUILYy,7,9,7,https://m.facebook.com/story.php?story_fbid=10157642204706888&id=24723976887,https://www.adnradio.cl/internacional/2020/03/23/placido-domingo-confirmo-que-tiene-covid-19-estoy-en-aislamiento-por-el-tiempo-que-sea-necesario.html
10157642182726888,"VIDEO | Suspendió servicios básicos por tres meses y apuntó contra los empresarios.
ADNRADIO.CL
El aplaudido discurso del presidente de El Salvador tras decretar cuarentena nacional",VIDEO | Suspendió servicios básicos por tres meses y apuntó contra los empresarios.,"ADNRADIO.CL
El aplaudido discurso del presidente de El Salvador tras decretar cuarentena nacional",2020-03-23 10:22:38,https://external.fscl6-1.fna.fbcdn.net/safe_image.php?d=AQD9q3CQqiFuHiGi&w=476&h=249&url=fbstaging%3A%2F%2Fgraph.facebook.com%2Fstaging_resources%2FMDE2MzA2NTIzMDQzODQ3NDk6NzgwMjExMDYw&cfs=1&jq=75&ext=jpg&_nc_hash=AQDtEdY_5stUTksx,1263,138,843,https://m.facebook.com/story.php?story_fbid=10157642182726888&id=24723976887,https://bit.ly/39fM5xk
10157642209871888,"Los televidentes aseguraron que la actriz se ve hasta “10 o 15 años menor”. 😱😱
#NoNoticia
ADNRADIO.CL
“Parece de 30”: Catalina Olcay sorprendió en La Divina Comida al revelar su edad","Los televidentes aseguraron que la actriz se ve hasta “10 o 15 años menor”. 😱😱
#NoNoticia","ADNRADIO.CL
“Parece de 30”: Catalina Olcay sorprendió en La Divina Comida al revelar su edad",2020-03-23 10:15:08,https://external.fscl6-1.fna.fbcdn.net/safe_image.php?d=AQDfE1_Z1h_XCmvw&w=476&h=249&url=https%3A%2F%2Fassets.adnradio.cl%2F2020%2F03%2Fcata-690x419.jpg&cfs=1&jq=75&ext=jpg&_nc_hash=AQAvExf3oxECShNa,524,109,21,https://m.facebook.com/story.php?story_fbid=10157642209871888&id=24723976887,https://www.adnradio.cl/espectaculos/2020/03/23/parece-de-30-catalina-olcay-sorprendio-en-la-divina-comida-al-revelar-su-edad.html
10157642247826888,"Se entregó el último balance en cuanto a los contagios.
ADNRADIO.CL
Minsal confirmó 746 casos de pacientes con coronavirus en Chile",Se entregó el último balance en cuanto a los contagios.,"ADNRADIO.CL
Minsal confirmó 746 casos de pacientes con coronavirus en Chile",2020-03-23 10:02:25,https://external.fscl6-1.fna.fbcdn.net/safe_image.php?d=AQDUUvTJ380DFqf8&w=476&h=249&url=https%3A%2F%2Fassets.adnradio.cl%2F2020%2F03%2FA_UNO_1165767-2-e1584968346433.jpg&cfs=1&jq=75&ext=jpg&_nc_hash=AQDEVGiN831Aok7O,77,245,84,https://m.facebook.com/story.php?story_fbid=10157642247826888&id=24723976887,https://www.adnradio.cl/nacional/2020/03/23/minsal-confirmo-746-casos-de-pacientes-con-coronavirus-en-chile.html
10157642137141888,"El delantero de la ""Roja"" se encuentra en México junto a su familia 😂😂😂.
ADNRADIO.CL
VIDEO | Eduardo Vargas publicó divertida broma a su mamá en medio de la cuarentena","El delantero de la ""Roja"" se encuentra en México junto a su familia 😂😂😂.","ADNRADIO.CL
VIDEO | Eduardo Vargas publicó divertida broma a su mamá en medio de la cuarentena",2020-03-23 09:57:21,https://external.fscl6-1.fna.fbcdn.net/safe_image.php?d=AQAyXoI5vGtK4Cvp&w=476&h=249&url=https%3A%2F%2Fassets.adnradio.cl%2F2020%2F03%2FA_UNO_1085053-e1584965881854.jpg&cfs=1&jq=75&ext=jpg&_nc_hash=AQCWmNVkSE1C0X73,22,8,7,https://m.facebook.com/story.php?story_fbid=10157642137141888&id=24723976887,http://adnradio.cl/futbol/2020/03/23/video-eduardo-vargas-publico-divertida-broma-a-su-mama-en-medio-de-la-cuarentena.html
